{"artifact_status":"draft","commit":"bba9b6846608359b87ed5393cb208e321f3ba8af","entrypoint":{"invocation_contract":"private-match-ae-fixed-cli/0.1","path":"vendor/ae-framework/scripts/assurance/aggregate-lanes.mjs","type":"vendored-reviewed-subset"},"input_schema_ids":["https://ae-framework/schema/assurance-profile.schema.json","https://itdo.jp/schemas/private-match/assurance/private-match-producer-package.v0.1.schema.json"],"license":"Apache-2.0","limitations":["The pinned command organizes supplied Evidence and is not an oracle of truth.","The pinned command provides neither a security proof nor certification.","The vendored subset is invoked offline and cannot authorize publication."],"output_contract_ids":["assurance-summary/v1","private-match-assurance-package/0.1"],"package":{"name":"ae-framework","version":"1.0.0"},"pin_digest":"sha256:7476eece164e3e82af99537c686e6bf98dcf084ac78d371b8a8a6f310d2e0778","repository":"itdojp/ae-framework","schema_version":"0.1","source_manifest":{"file_digest":"sha256:75d8f22f8f64e103f6e2ffa6a58dcf7faaee9ad548d1d7d64aab1b1ef3ae2041","manifest_digest":"sha256:2438ffc80dee67a31bf629832f09a8db582886a6cba660d7d844ac04d15129a3","path":"vendor/ae-framework/source-manifest.v0.1.json","source_tree_digest":"sha256:f9348a5f49d7c5d7e01e53914829434a3d43d9c048eaae56171ca67c93391729"},"tested_runtime":{"architecture":"x86_64","node":"22.22.2","operating_system":"Ubuntu 24.04","python":"3.12"}}
